{
  "shape": {
    "shape_type": "cone",
    "base_diameter_cm": 12.0,
    "top_diameter_cm": 4.0,
    "height_cm": 15.0
  },
  "gauge": {
    "stitches_per_cm": 1.3,
    "rows_per_cm": 1.5,
    "hook_size_mm": 4.5,
    "yarn_weight": "worsted",
    "swatch_notes": "Worked in single crochet with worsted weight yarn and larger hook"
  },
  "rounds": [
    {
      "round_number": 0,
      "stitches": [
        {
          "stitch_type": "ch",
          "count": 2,
          "target": null,
          "note": "Magic ring or ch 2"
        },
        {
          "stitch_type": "sc",
          "count": 6,
          "target": "second ch from hook",
          "note": null
        }
      ],
      "total_stitches": 6,
      "description": "Start: magic ring, 6 sc"
    },
    {
      "round_number": 1,
      "stitches": [
        {
          "stitch_type": "inc",
          "count": 6,
          "target": "each st",
          "note": "2 sc in each st"
        }
      ],
      "total_stitches": 12,
      "description": "inc around (12)"
    },
    {
      "round_number": 2,
      "stitches": [
        {
          "stitch_type": "sc",
          "count": 1,
          "target": "next st",
          "note": null
        },
        {
          "stitch_type": "inc",
          "count": 1,
          "target": "next st",
          "note": null
        }
      ],
      "total_stitches": 18,
      "description": "[sc, inc] around (18)"
    },
    {
      "round_number": 3,
      "stitches": [
        {
          "stitch_type": "sc",
          "count": 2,
          "target": "next 2 sts",
          "note": null
        },
        {
          "stitch_type": "inc",
          "count": 1,
          "target": "next st",
          "note": null
        }
      ],
      "total_stitches": 24,
      "description": "[sc 2, inc] around (24)"
    },
    {
      "round_number": 4,
      "stitches": [
        {
          "stitch_type": "sc",
          "count": 3,
          "target": "next 3 sts",
          "note": null
        },
        {
          "stitch_type": "inc",
          "count": 1,
          "target": "next st",
          "note": null
        }
      ],
      "total_stitches": 30,
      "description": "[sc 3, inc] around (30)"
    },
    {
      "round_number": 5,
      "stitches": [
        {
          "stitch_type": "sc",
          "count": 4,
          "target": "next 4 sts",
          "note": null
        },
        {
          "stitch_type": "inc",
          "count": 1,
          "target": "next st",
          "note": null
        }
      ],
      "total_stitches": 36,
      "description": "[sc 4, inc] around (36)"
    },
    {
      "round_number": 6,
      "stitches": [
        {
          "stitch_type": "sc",
          "count": 5,
          "target": "next 5 sts",
          "note": null
        },
        {
          "stitch_type": "inc",
          "count": 1,
          "target": "next st",
          "note": null
        }
      ],
      "total_stitches": 42,
      "description": "[sc 5, inc] around (42)"
    },
    {
      "round_number": 7,
      "stitches": [
        {
          "stitch_type": "sc",
          "count": 6,
          "target": "next 6 sts",
          "note": null
        },
        {
          "stitch_type": "inc",
          "count": 1,
          "target": "next st",
          "note": null
        }
      ],
      "total_stitches": 48,
      "description": "[sc 6, inc] around (48)"
    },
    {
      "round_number": 8,
      "stitches": [
        {
          "stitch_type": "sc",
          "count": 48,
          "target": "each st",
          "note": null
        }
      ],
      "total_stitches": 48,
      "description": "sc around (48)"
    },
    {
      "round_number": 9,
      "stitches": [
        {
          "stitch_type": "sc",
          "count": 6,
          "target": "next 6 sts",
          "note": null
        },
        {
          "stitch_type": "dec",
          "count": 1,
          "target": "next 2 sts",
          "note": "sc2tog"
        }
      ],
      "total_stitches": 42,
      "description": "[sc 6, dec] around (42)"
    },
    {
      "round_number": 10,
      "stitches": [
        {
          "stitch_type": "sc",
          "count": 42,
          "target": "each st",
          "note": null
        }
      ],
      "total_stitches": 42,
      "description": "sc around (42)"
    },
    {
      "round_number": 11,
      "stitches": [
        {
          "stitch_type": "sc",
          "count": 5,
          "target": "next 5 sts",
          "note": null
        },
        {
          "stitch_type": "dec",
          "count": 1,
          "target": "next 2 sts",
          "note": "sc2tog"
        }
      ],
      "total_stitches": 36,
      "description": "[sc 5, dec] around (36)"
    },
    {
      "round_number": 12,
      "stitches": [
        {
          "stitch_type": "sc",
          "count": 36,
          "target": "each st",
          "note": null
        }
      ],
      "total_stitches": 36,
      "description": "sc around (36)"
    },
    {
      "round_number": 13,
      "stitches": [
        {
          "stitch_type": "sc",
          "count": 4,
          "target": "next 4 sts",
          "note": null
        },
        {
          "stitch_type": "dec",
          "count": 1,
          "target": "next 2 sts",
          "note": "sc2tog"
        }
      ],
      "total_stitches": 30,
      "description": "[sc 4, dec] around (30)"
    },
    {
      "round_number": 14,
      "stitches": [
        {
          "stitch_type": "sc",
          "count": 30,
          "target": "each st",
          "note": null
        }
      ],
      "total_stitches": 30,
      "description": "sc around (30)"
    },
    {
      "round_number": 15,
      "stitches": [
        {
          "stitch_type": "sc",
          "count": 3,
          "target": "next 3 sts",
          "note": null
        },
        {
          "stitch_type": "dec",
          "count": 1,
          "target": "next 2 sts",
          "note": "sc2tog"
        }
      ],
      "total_stitches": 24,
      "description": "[sc 3, dec] around (24)"
    },
    {
      "round_number": 16,
      "stitches": [
        {
          "stitch_type": "sc",
          "count": 24,
          "target": "each st",
          "note": null
        }
      ],
      "total_stitches": 24,
      "description": "sc around (24)"
    },
    {
      "round_number": 17,
      "stitches": [
        {
          "stitch_type": "sc",
          "count": 2,
          "target": "next 2 sts",
          "note": null
        },
        {
          "stitch_type": "dec",
          "count": 1,
          "target": "next 2 sts",
          "note": "sc2tog"
        }
      ],
      "total_stitches": 18,
      "description": "[sc 2, dec] around (18)"
    },
    {
      "round_number": 18,
      "stitches": [
        {
          "stitch_type": "sc",
          "count": 18,
          "target": "each st",
          "note": null
        }
      ],
      "total_stitches": 18,
      "description": "sc around (18)"
    },
    {
      "round_number": 19,
      "stitches": [
        {
          "stitch_type": "sc",
          "count": 1,
          "target": "next st",
          "note": null
        },
        {
          "stitch_type": "dec",
          "count": 1,
          "target": "next 2 sts",
          "note": "sc2tog"
        }
      ],
      "total_stitches": 12,
      "description": "[sc, dec] around (12)"
    },
    {
      "round_number": 20,
      "stitches": [
        {
          "stitch_type": "slst",
          "count": 1,
          "target": "next st",
          "note": "slip stitch to close"
        }
      ],
      "total_stitches": 12,
      "description": "Fasten off"
    }
  ],
  "metadata": {
    "generated_at": "2024-11-10T10:40:00Z",
    "engine_version": "0.1.0",
    "total_rounds": 21,
    "estimated_time_minutes": 90,
    "difficulty": "intermediate",
    "tags": ["cone", "3d-shape", "tapered", "ice-cream-cone", "party-hat"]
  },
  "notes": "Work in continuous spiral. Stuff firmly as you go. The cone tapers from a wide base to a narrower top. Perfect for party hats, ice cream cones, or tree toppers."
}
