{
  "shape": {
    "shape_type": "sphere",
    "diameter_cm": 10.0
  },
  "gauge": {
    "stitches_per_cm": 1.4,
    "rows_per_cm": 1.6,
    "hook_size_mm": 4.0,
    "yarn_weight": "worsted",
    "swatch_notes": "Worked in single crochet with worsted weight yarn"
  },
  "rounds": [
    {
      "round_number": 0,
      "stitches": [
        {
          "stitch_type": "ch",
          "count": 2,
          "target": null,
          "note": "Magic ring alternative: ch 2"
        },
        {
          "stitch_type": "sc",
          "count": 6,
          "target": "second ch from hook",
          "note": null
        }
      ],
      "total_stitches": 6,
      "description": "Start with magic ring, 6 sc"
    },
    {
      "round_number": 1,
      "stitches": [
        {
          "stitch_type": "inc",
          "count": 6,
          "target": "each st",
          "note": "2 sc in each stitch around"
        }
      ],
      "total_stitches": 12,
      "description": "Increase round: 2 sc in each st (12)"
    },
    {
      "round_number": 2,
      "stitches": [
        {
          "stitch_type": "sc",
          "count": 1,
          "target": "next st",
          "note": null
        },
        {
          "stitch_type": "inc",
          "count": 1,
          "target": "next st",
          "note": null
        }
      ],
      "total_stitches": 18,
      "description": "[sc, inc] around (18)"
    },
    {
      "round_number": 3,
      "stitches": [
        {
          "stitch_type": "sc",
          "count": 2,
          "target": "next 2 sts",
          "note": null
        },
        {
          "stitch_type": "inc",
          "count": 1,
          "target": "next st",
          "note": null
        }
      ],
      "total_stitches": 24,
      "description": "[sc 2, inc] around (24)"
    },
    {
      "round_number": 4,
      "stitches": [
        {
          "stitch_type": "sc",
          "count": 24,
          "target": "each st",
          "note": null
        }
      ],
      "total_stitches": 24,
      "description": "sc around, no increases (24)"
    },
    {
      "round_number": 5,
      "stitches": [
        {
          "stitch_type": "sc",
          "count": 2,
          "target": "next 2 sts",
          "note": null
        },
        {
          "stitch_type": "dec",
          "count": 1,
          "target": "next 2 sts",
          "note": "sc2tog"
        }
      ],
      "total_stitches": 18,
      "description": "[sc 2, dec] around (18)"
    },
    {
      "round_number": 6,
      "stitches": [
        {
          "stitch_type": "sc",
          "count": 1,
          "target": "next st",
          "note": null
        },
        {
          "stitch_type": "dec",
          "count": 1,
          "target": "next 2 sts",
          "note": "sc2tog"
        }
      ],
      "total_stitches": 12,
      "description": "[sc, dec] around (12)"
    },
    {
      "round_number": 7,
      "stitches": [
        {
          "stitch_type": "dec",
          "count": 6,
          "target": "next 2 sts",
          "note": "sc2tog around"
        }
      ],
      "total_stitches": 6,
      "description": "dec around (6)"
    }
  ],
  "metadata": {
    "generated_at": "2024-11-10T10:30:00Z",
    "engine_version": "0.1.0",
    "total_rounds": 8,
    "estimated_time_minutes": 45,
    "difficulty": "beginner",
    "tags": ["sphere", "3d-shape", "amigurumi", "beginner-friendly"]
  },
  "notes": "Work in continuous spiral. Use stitch marker to track beginning of rounds. Stuff firmly with polyfill before closing."
}
